### ISSUE TITLE
Gitea times out on large repository push

### ISSUE THREAD

**Issue by dvadura** [go-gitea/gitea#36794]
### Description

1. Gitea v1.25.4, Linux (although that should be irrelevant)
2. Large repository, takes > 30s to enumerate objects.
3. User connects successfully (via ssh), after 30s gets:

> **Connection to repo.badunetworks.com closed by remote host.
> send-pack: unexpected disconnect while reading sideband packet**

Root cause is a server **30s** timeout:

```
tcpdump: verbose output suppressed, use -v or -vv for full protocol decode
listening on enp7s0, link-type EN10MB (Ethernet), capture size 262144 bytes
 00:00:00.000000 IP 192.168.100.1.51336 > 192.168.100.70.2200: Flags [S], seq 629434463, win 29200, options [mss 1460,sackOK,TS val 4011034951 ecr 0,nop,wscale 7], length 0
 00:00:00.000081 IP 192.168.100.70.2200 > 192.168.100.1.51336: Flags [S.], seq 4213453695, ack 629434464, win 28960, options [mss 1460,sackOK,TS val 1685284310 ecr 4011034951,nop,wscale 7], length 0
 00:00:00.000233 IP 192.168.100.1.51336 > 192.168.100.70.2200: Flags [.], ack 1, win 229, options [nop,nop,TS val 4011034951 ecr 1685284310], length 0
 00:00:00.000273 IP 192.168.100.1.51336 > 192.168.100.70.2200: Flags [P.], seq 1:22, ack 1, win 229, options [nop,nop,TS val 4011034951 ecr 1685284310], length 21
 00:00:00.000287 IP 192.168.100.70.2200 > 192.168.100.1.51336: Flags [.], ack 22, win 227, options [nop,nop,TS val 1685284310 ecr 4011034951], length 0
 00:00:00.000598 IP 192.168.100.70.2200 > 192.168.100.1.51336: Flags [P.], seq 1:13, ack 22, win 227, options [nop,nop,TS val 1685284311 ecr 4011034951], length 12
 00:00:00.000714 IP 192.168.100.1.51336 > 192.168.100.70.2200: Flags [.], ack 13, win 229, options [nop,nop,TS val 4011034952 ecr 1685284311], length 0
 00:00:00.000756 IP 192.168.100.70.2200 > 192.168.100.1.51336: Flags [P.], seq 13:781, ack 22, win 227, options [nop,nop,TS val 1685284311 ecr 4011034952], length 768
 00:00:00.000851 IP 192.168.100.1.51336 > 192.168.100.70.2200: Flags [.], ack 781, win 241, options [nop,nop,TS val 4011034952 ecr 1685284311], length 0
 00:00:00.001744 IP 192.168.100.1.51336 > 192.168.100.70.2200: Flags [P.], seq 22:1422, ack 781, win 241, options [nop,nop,TS val 4011034953 ecr 1685284311], length 1400
 00:00:00.042528 IP 192.168.100.70.2200 > 192.168.100.1.51336: Flags [.], ack 1422, win 249, options [nop,nop,TS val 1685284353 ecr 4011034953], length 0
 00:00:00.043136 IP 192.168.100.1.51336 > 192.168.100.70.2200: Flags [P.], seq 1422:2654, ack 781, win 241, options [nop,nop,TS val 4011034994 ecr 1685284353], length 1232
 00:00:00.043165 IP 192.168.100.70.2200 > 192.168.100.1.51336: Flags [.], ack 2654, win 272, options [nop,nop,TS val 1685284353 ecr 4011034994], length 0
 00:00:00.055323 IP 192.168.100.70.2200 > 192.168.100.1.51336: Flags [P.], seq 781:3005, ack 2654, win 272, options [nop,nop,TS val 1685284365 ecr 4011034994], length 2224
 00:00:00.055440 IP 192.168.100.1.51336 > 192.168.100.70.2200: Flags [.], ack 3005, win 275, options [nop,nop,TS val 4011035007 ecr 1685284365], length 0
 00:00:00.055460 IP 192.168.100.70.2200 > 192.168.100.1.51336: Flags [P.], seq 3005:3281, ack 2654, win 272, options [nop,nop,TS val 1685284365 ecr 4011035007], length 276
 00:00:00.058320 IP 192.168.100.1.51336 > 192.168.100.70.2200: Flags [P.], seq 2654:2670, ack 3281, win 298, options [nop,nop,TS val 4011035009 ecr 1685284365], length 16
 00:00:00.098561 IP 192.168.100.70.2200 > 192.168.100.1.51336: Flags [.], ack 2670, win 272, options [nop,nop,TS val 1685284409 ecr 4011035009], length 0
 00:00:00.099259 IP 192.168.100.1.51336 > 192.168.100.70.2200: Flags [P.], seq 2670:2722, ack 3281, win 298, options [nop,nop,TS val 4011035050 ecr 1685284409], length 52
 00:00:00.099282 IP 192.168.100.70.2200 > 192.168.100.1.51336: Flags [.], ack 2722, win 272, options [nop,nop,TS val 1685284409 ecr 4011035050], length 0
 00:00:00.099438 IP 192.168.100.70.2200 > 192.168.100.1.51336: Flags [P.], seq 3281:3333, ack 2722, win 272, options [nop,nop,TS val 1685284409 ecr 4011035050], length 52
 00:00:00.100611 IP 192.168.100.1.51336 > 192.168.100.70.2200: Flags [P.], seq 2722:2790, ack 3333, win 298, options [nop,nop,TS val 4011035052 ecr 1685284409], length 68
 00:00:00.100743 IP 192.168.100.70.2200 > 192.168.100.1.51336: Flags [P.], seq 3333:3385, ack 2790, win 272, options [nop,nop,TS val 1685284411 ecr 4011035052], length 52
 00:00:00.101978 IP 192.168.100.1.51336 > 192.168.100.70.2200: Flags [P.], seq 2790:2938, ack 3385, win 298, options [nop,nop,TS val 4011035053 ecr 1685284411], length 148
 00:00:00.104046 IP 192.168.100.70.2200 > 192.168.100.1.51336: Flags [P.], seq 3385:3485, ack 2938, win 294, options [nop,nop,TS val 1685284414 ecr 4011035053], length 100
 00:00:00.105488 IP 192.168.100.1.51336 > 192.168.100.70.2200: Flags [P.], seq 2938:3166, ack 3485, win 298, options [nop,nop,TS val 4011035057 ecr 1685284414], length 228
 00:00:00.106151 IP 192.168.100.70.2200 > 192.168.100.1.51336: Flags [P.], seq 3485:3521, ack 3166, win 316, options [nop,nop,TS val 1685284416 ecr 4011035057], length 36
 00:00:00.107165 IP 192.168.100.1.51336 > 192.168.100.70.2200: Flags [P.], seq 3166:3218, ack 3521, win 298, options [nop,nop,TS val 4011035058 ecr 1685284416], length 52
 00:00:00.107344 IP 192.168.100.70.2200 > 192.168.100.1.51336: Flags [P.], seq 3521:3573, ack 3218, win 316, options [nop,nop,TS val 1685284417 ecr 4011035058], length 52
 00:00:00.108438 IP 192.168.100.1.51336 > 192.168.100.70.2200: Flags [P.], seq 3218:3318, ack 3573, win 298, options [nop,nop,TS val 4011035059 ecr 1685284417], length 100
 00:00:00.108543 IP 192.168.100.70.2200 > 192.168.100.1.51336: Flags [P.], seq 3573:3609, ack 3318, win 316, options [nop,nop,TS val 1685284419 ecr 4011035059], length 36
 00:00:00.149447 IP 192.168.100.1.51336 > 192.168.100.70.2200: Flags [.], ack 3609, win 298, options [nop,nop,TS val 4011035101 ecr 1685284419], length 0
 00:00:00.229387 IP 192.168.100.70.2200 > 192.168.100.1.51336: Flags [P.], seq 3609:3837, ack 3318, win 316, options [nop,nop,TS val 1685284539 ecr 4011035101], length 228
 00:00:00.229508 IP 192.168.100.1.51336 > 192.168.100.70.2200: Flags [.], ack 3837, win 321, options [nop,nop,TS val 4011035181 ecr 1685284539], length 0
 00:00:00.232153 IP 192.168.100.1.51336 > 192.168.100.70.2200: Flags [P.], seq 3318:3546, ack 3837, win 321, options [nop,nop,TS val 4011035183 ecr 1685284539], length 228
 00:00:00.272521 IP 192.168.100.70.2200 > 192.168.100.1.51336: Flags [.], ack 3546, win 338, options [nop,nop,TS val 1685284583 ecr 4011035183], length 0


 00:00:30.233561 IP 192.168.100.1.51336 > 192.168.100.70.2200: Flags [F.], seq 3546, ack 3837, win 321, options [nop,nop,TS val 4011065185 ecr 1685284583], length 0
 00:00:30.233609 IP 192.168.100.1.51336 > 192.168.100.70.2200: Flags [R.], seq 3547, ack 3837, 
```

Server closes connection after 30s (no traffic), sends FIN, receives RST.

Relevant configuration:
```
SSH_PORT = 2200
SSH_LISTEN_PORT = 2200
SSH_PER_WRITE_TIMEOUT = -1
SSH_PER_WRITE_PER_KB_TIMEOUT = -1
START_SSH_SERVER = true
DISABLE_SSH = false
USE_COMPAT_SSH_URI = true
PER_WRITE_TIMEOUT = -1
PER_WRITE_PER_KB_TIMEOUT = -1
```
Could not find any other timeout config in the documentation. Using gitea's internal SSH server so the timeout is coming purely from gitea. Looks like this might be a contributing factor to some/many of the previous connection close reports. In my case counting the objects (Linux Kernel) takes about 60s.

Cannot use https URI as that fails with a different buffer overflow, as post is too big.

**To replicate:**
Clone full linux kernel repo and fetch --all, attempt to push --all to new gitea repo somewhere.

### Gitea Version

1.25.4

### Can you reproduce the bug on the Gitea demo site?

No

### Operating System

Linux

### How are you running Gitea?

Rocky Linux VM, no issues other than this.

### Database

None

**Comment by TheFox0x7** [comment]
set `[server].SSH_PER_WRITE_TIMEOUT` to higher value

**Comment by dvadura** [comment]
No joy, 

[server].SSH_PER_WRITE_TIMEOUT = 600s

results in:
```
00:00:04.370798 IP 192.168.100.1.41838 > 192.168.100.70.2200: Flags [P.], seq 3218:3318, ack 3573, win 298, options [nop,nop,TS val 4012698556 ecr 1686947914], length 100
 00:00:04.370931 IP 192.168.100.70.2200 > 192.168.100.1.41838: Flags [P.], seq 3573:3609, ack 3318, win 316, options [nop,nop,TS val 1686947916 ecr 4012698556], length 36
 00:00:04.411302 IP 192.168.100.1.41838 > 192.168.100.70.2200: Flags [.], ack 3609, win 298, options [nop,nop,TS val 4012698597 ecr 1686947916], length 0
 00:00:04.477068 IP 192.168.100.70.2200 > 192.168.100.1.41838: Flags [P.], seq 3609:3837, ack 3318, win 316, options [nop,nop,TS val 1686948022 ecr 4012698597], length 228
 00:00:04.477188 IP 192.168.100.1.41838 > 192.168.100.70.2200: Flags [.], ack 3837, win 321, options [nop,nop,TS val 4012698662 ecr 1686948022], length 0
 00:00:04.479657 IP 192.168.100.1.41838 > 192.168.100.70.2200: Flags [P.], seq 3318:3546, ack 3837, win 321, options [nop,nop,TS val 4012698665 ecr 1686948022], length 228
 00:00:04.519890 IP 192.168.100.70.2200 > 192.168.100.1.41838: Flags [.], ack 3546, win 338, options [nop,nop,TS val 1686948065 ecr 4012698665], length 0


 00:00:34.481376 IP 192.168.100.1.41838 > 192.168.100.70.2200: Flags [F.], seq 3546, ack 3837, win 321, options [nop,nop,TS val 4012728666 ecr 1686948065], length 0
 00:00:34.481424 IP 192.168.100.1.41838 > 192.168.100.70.2200: Flags [R.], seq 3547, ack 3837, win 321, options [nop,nop,TS val 4012728666 ecr 1686948065], length 0
```

still a 30s timeout, and from the docs, setting it to -1 is supposed to disable the timeout.

**Comment by dvadura** [comment]
I found the issue though. It's SSL timing out (which is giteas interal ssl implementation).

I fixed it using ssh_config in the client:
```
Host repo.....
   ServerAliveInterval 15 
   ServerAliveCountMax 40
```
So that it pings the server every 15 sec, while git does it's thing. This explains why some people had success disabling some git compression etc, as that changed the timing.

At minimum this should be documented, and ideally an SSH_CLIENT_TIMEOUT config in app.ini would be nice.

Leaving issue open, so that some resolution is implemented.

**Comment by anygotthat** [comment]
@dvadura Could you please try changing the SSH write timeout settings to the following values and restart Gitea?

```ini
[server]
SSH_PER_WRITE_TIMEOUT = -1ns
SSH_PER_WRITE_PER_KB_TIMEOUT = -1ns
```

The documented value `-1` is intended to disable the timeout, but Gitea parses duration values using Go’s duration format. A bare `-1` is not a valid duration because it has no unit, so it may silently fall back to the default 30-second timeout. This matches the disconnect occurring after approximately 30 seconds.

`-1ns` is a valid negative duration and should disable the SSH write timeout. After restarting Gitea, please retry the large repository push and let us know whether the issue persists.
