### ISSUE TITLE
Cannot clone via Gitea Internal SSH Server

### ISSUE THREAD

**Issue by anatanna** [go-gitea/gitea#9697]
- Gitea version (or commit ref): 1.10.2 / binary installation
- Git version: 2.8.4-1.el7.centos
- Operating system: CentOS 7
- Database (use `[x]`):
  - [ ] PostgreSQL
  - [ ] MySQL
  - [ ] MSSQL
  - [x] SQLite
- Can you reproduce the bug at https://try.gitea.io:
  - [ ] Yes (provide example URL)
  - [x] No
  - [ ] Not relevant
- Log gist:
```2020/01/10 16:03:34 routers/init.go:111:GlobalInit() [I] SQLite3 Supported
2020/01/10 16:03:34 routers/init.go:39:checkRunMode() [I] Run Mode: Production
2020/01/10 16:03:34 routers/init.go:117:GlobalInit() [I] SSH server started on scm.example.com:2222. Cipher list ([aes128-ctr aes192-ctr aes256-ctr aes128-gcm@openssh.com arcfour256 arcfour128]), key exchange algorithms ([diffie-hellman-group1-sha1 diffie-hellman-group14-sha1 ecdh-sha2-nistp256 ecdh-sha2-nistp384 ecdh-sha2-nistp521 curve25519-sha256@libssh.org]), MACs ([hmac-sha2-256-etm@openssh.com hmac-sha2-256 hmac-sha1 hmac-sha1-96])
2020/01/10 16:03:35 cmd/web.go:151:runWeb() [I] Listen: http://0.0.0.0:3000
2020/01/10 16:03:35 ...ce/gracehttp/http.go:142:Serve() [I] Serving [::]:3000 with pid 12188
```

## Description
Can't clone repo via build-in SSH Server.

Config:
```
RUN_USER = gitea
RUN_MODE = prod

[server]
DOMAIN           = scm.example.com
HTTP_PORT        = 3000
ROOT_URL         = http://scm.example.com:3000/
DISABLE_SSH      = false
START_SSH_SERVER = true
SSH_DOMAIN       = scm.example.com
SSH_PORT         = 2222
SSH_LISTEN_HOST  = scm.example.com
SSH_LISTEN_PORT  = 2222
```
With there settings i can run from Windows Git Bash
```
$ ssh gitea@scm.example.com -p 2222
agent key RSA SHA256:Wh2+Pn5JhKGXlV8UsMmnG6NIY37LcpgH+NDwTpGpDoc returned incorrect signature type
PTY allocation request failed on channel 0
Hi there, user.name! You've successfully authenticated with the key named user.name@example.com   , but Gitea does not provide shell access.
If this is unexpected, please log in with password and setup Gitea under another user.
Connection to scm.example.com closed.
```
I can clone repository via HTTP, but when i run `git clone ssh://gitea@scm.example.com:2222/repo/path.git` via SSH, it's freezing. I added my ssh pub_key to Gitea user and i suppose if Gitea answer with the message " Hi there, user.name! You've successfully authenticated... but Gitea does not provide shell access" it can get/read this pub_key from sqllite db. But it's not workung for cloning.

There is no FW on this test CentOS instance, i tested to turn off SELinux, no effect.
```
# lsof -i -P | grep gitea
gitea     12188  gitea   12u  IPv4 130554      0t0  TCP scm.example.com:2222 (LISTEN)
gitea     12188  gitea   13u  IPv6 130559      0t0  TCP *:3000 (LISTEN)
```
What am i missing?

**Comment by lunny** [comment]
It seems there some spaces after your email?

**Comment by anatanna** [comment]
You've right. In db in INSERT row for ssh_key was '\t' sign. Seems i pressed Tab between keyname textfield and contents.
Deleted this SSH key from Gitea user and added again without Tab pressing. 
Now i get this : 
```
$ ssh -T gitea@scm.example.com
agent key RSA SHA256:Wh2+Pn5JhKGXlV8UsMmnG6NIY37LcpgH+NDwTpGpDoc returned incorrect signature type
Gitea: Internal error
Failed to check provided key: Cannot find key: 1
```
But SHA256 corresponds.
``` 
These public SSH keys are associated with your account. The corresponding private keys allow full access to your repositories.

user.name@example.com
SHA256:Wh2+Pn5JhKGXlV8UsMmnG6NIY37LcpgH+NDwTpGpDoc
Added on Jan 11, 2020 — No recent activity
```

**Comment by lunny** [comment]
Please go to admin panel on your gitea UI and run `Update the '.ssh/authorized_keys' file with Gitea SSH keys. (Not needed for the built-in SSH server.)` and try again.

**Comment by anatanna** [comment]
Done.
No effect.
The same error:
"Gitea: Internal error
Failed to check provided key: Cannot find key: 1"

**Comment by anatanna** [comment]
I recreated user from the beginning, added ssh_pub key
```
$ ssh -T gitea@scm.example.com
agent key RSA SHA256:Wh2+Pn5JhKGXlV8UsMmnG6NIY37LcpgH+NDwTpGpDoc returned incorrect signature type
Hi there, user.name! You've successfully authenticated with the key named user.name@example.com, but Gitea does not provide shell access.
If this is unexpected, please log in with password and setup Gitea under another user.
```
deleted ssh_pub key, added it again
```
$ ssh -T gitea@scm.example.com
agent key RSA SHA256:Wh2+Pn5JhKGXlV8UsMmnG6NIY37LcpgH+NDwTpGpDoc returned incorrect signature type
Gitea: Internal error
Failed to check provided key: Cannot find key: 1
```

**Comment by zeripath** [comment]
Ok, so after you re-added the key your authorized_keys file should have changed. But clearly it didn't. I'm not certain why that would happen. Does Gitea have permission to write to the .ssh/authorized_keys file? Is it trying to write to the wrong place?

The reason why readding the key would make this break is because it's key number would change from key-1 to key-2.

Find your authorized keys file for Gitea user. Take a copy and then delete it, after of course ensuring you can still get to your server prompt via another user etc.

Try to get Gitea to recreate the authorized keys file. See if it's recreating it in the right place.

**Comment by lunny** [comment]
OKay. I'm worong. It seems @anatanna was using internal SSH configuration.

**Comment by zeripath** [comment]
OK, then let's ignore the authorized_keys view part... 

The error report comes from:

https://github.com/go-gitea/gitea/blob/497e15fdc28518ab03e2f1114fb112b8c0630e18/cmd/serv.go#L115

Originally from here:

https://github.com/go-gitea/gitea/blob/497e15fdc28518ab03e2f1114fb112b8c0630e18/routers/private/serv.go#L37

The key is found here:

https://github.com/go-gitea/gitea/blob/497e15fdc28518ab03e2f1114fb112b8c0630e18/modules/ssh/ssh.go#L139

The only way this can happen is if the Gitea that Serv talks to is not the Gitea that sent it there or something is very odd about the DB.

**Comment by anatanna** [comment]
I do not quite understand, what exactly is wrong in my config.
```
# lsof -i -P | grep gitea
gitea     12188  gitea   12u  IPv4 130554      0t0  TCP scm.example.com:2222 (LISTEN)
gitea     12188  gitea   13u  IPv6 130559      0t0  TCP *:3000 (LISTEN)
```
Internal SSH server runs under gitea user. 
Gitea user is owner for gitea.db sqlite DB file
```
# ls -l gitea.db 
-rw-r--r--. 1 gitea gitea 1101824 Jan 12 03:21 gitea.db
```

**Comment by techknowlogick** [comment]
> gitea     12188  gitea   12u  IPv4 130554      0t0  TCP scm.example.com:2222 (LISTEN)

Listening on port 2222, so makes sense there is an error when you try to clone on port 22

**Comment by anatanna** [comment]
but i clone on 2222 with command 
```
$ git clone ssh://gitea@scm.example.com:2222/fg-admin/new-repo.git
Cloning into 'new-repo'...
The server's host key is not cached in the registry. You
have no guarantee that the server is the computer you
think it is.
The server's rsa2 key fingerprint is:
ssh-rsa 2048 db:49:3e:20:24:24:b1:1b:83:23:00:d9:f0:74:f2:be
If you trust this host, enter "y" to add the key to
PuTTY's cache and carry on connecting.
If you want to carry on connecting just once, without
adding the key to the cache, enter "n".
If you do not trust this host, press Return to abandon the
connection.
Store key in cache? (y/n) y
```
The same clone command(with port) works perfectly for other git server - butbucket, which also have build-in ssh server on non standard 22 port .

**Comment by techknowlogick** [comment]
When you try to debug with `ssh -T gitea@scm.example.com` to verify you aren't sending your port, so it assumes port 22.

When cloning above with port I don't see an error, it looks like it is asking you to verify the key.

**Comment by anatanna** [comment]
The problem with cloning is that it is freezing after question `Store key in cache? (y/n) y`. There is no problem to get answer with `ssh -T gitea@scm.example.com -p 2222`.

**Comment by anatanna** [comment]
Can anybody **reproduce** the issue? Config for buildin ssh server is in description above.

on client Windows (10.2.4.69) run command 
`$ git clone ssh://gitea@scm.example.com:2222/fg-admin/new-repo.git`

meanwhile on CentOS (10.2.4.240) with Gitea+Build-in SSH i catch following:
```
[root@scm data]# tcpdump -i enp0s3 -nn port 2222
tcpdump: verbose output suppressed, use -v or -vv for full protocol decode
listening on enp0s3, link-type EN10MB (Ethernet), capture size 262144 bytes
23:03:08.274219 IP 10.2.4.69.57346 > 10.2.4.240.2222: Flags [S], seq 2787275674, win 64240, options [mss 1460,nop,wscale 8,nop,nop,sackOK], length 0
23:03:08.274291 IP 10.2.4.240.2222 > 10.2.4.69.57346: Flags [S.], seq 1541091103, ack 2787275675, win 29200, options [mss 1460,nop,nop,sackOK,nop,wscale 7], length 0
23:03:08.274464 IP 10.2.4.69.57346 > 10.2.4.240.2222: Flags [.], ack 1, win 8212, length 0
23:03:08.274488 IP 10.2.4.69.57346 > 10.2.4.240.2222: Flags [P.], seq 1:29, ack 1, win 8212, length 28
23:03:08.274499 IP 10.2.4.240.2222 > 10.2.4.69.57346: Flags [.], ack 29, win 229, length 0
23:03:08.274820 IP 10.2.4.240.2222 > 10.2.4.69.57346: Flags [P.], seq 1:13, ack 29, win 229, length 12
23:03:08.275010 IP 10.2.4.240.2222 > 10.2.4.69.57346: Flags [P.], seq 13:525, ack 29, win 229, length 512
23:03:08.275125 IP 10.2.4.69.57346 > 10.2.4.240.2222: Flags [.], ack 525, win 8210, length 0
23:03:08.275636 IP 10.2.4.69.57346 > 10.2.4.240.2222: Flags [P.], seq 29:1133, ack 525, win 8210, length 1104
23:03:08.319671 IP 10.2.4.240.2222 > 10.2.4.69.57346: Flags [.], ack 1133, win 251, length 0
23:03:08.319782 IP 10.2.4.69.57346 > 10.2.4.240.2222: Flags [P.], seq 1133:1181, ack 525, win 8210, length 48
23:03:08.319801 IP 10.2.4.240.2222 > 10.2.4.69.57346: Flags [.], ack 1181, win 251, length 0
23:03:08.327267 IP 10.2.4.240.2222 > 10.2.4.69.57346: Flags [P.], seq 525:1133, ack 1181, win 251, length 608
23:03:08.327485 IP 10.2.4.240.2222 > 10.2.4.69.57346: Flags [P.], seq 1133:1149, ack 1181, win 251, length 16  
------^^^^^^^ here i press 'y' on Store key in cache? (y/n) 
<<<<<<<< nothing happens afterwards. client hangs upp without activity
23:03:08.327634 IP 10.2.4.69.57346 > 10.2.4.240.2222: Flags [.], ack 1149, win 8208, length 0
23:03:23.336174 IP 10.2.4.240.2222 > 10.2.4.69.57346: Flags [.], ack 1181, win 251, length 0
23:03:23.336587 IP 10.2.4.69.57346 > 10.2.4.240.2222: Flags [.], ack 1149, win 8208, length 0
23:03:38.364489 IP 10.2.4.240.2222 > 10.2.4.69.57346: Flags [.], ack 1181, win 251, length 0
23:03:38.364782 IP 10.2.4.69.57346 > 10.2.4.240.2222: Flags [.], ack 1149, win 8208, length 0
23:03:53.374800 IP 10.2.4.240.2222 > 10.2.4.69.57346: Flags [.], ack 1181, win 251, length 0
23:03:53.375103 IP 10.2.4.69.57346 > 10.2.4.240.2222: Flags [.], ack 1149, win 8208, length 0
23:04:08.420295 IP 10.2.4.240.2222 > 10.2.4.69.57346: Flags [.], ack 1181, win 251, length 0
23:04:08.420812 IP 10.2.4.69.57346 > 10.2.4.240.2222: Flags [.], ack 1149, win 8208, length 0
23:04:18.159868 IP 10.2.4.69.57346 > 10.2.4.240.2222: Flags [R.], seq 1181, ack 1149, win 0, length 0 
--------^^^^^^^^^ Ctrl + C on client
^C
24 packets captured
24 packets received by filter
0 packets dropped by kernel
```
Does anyone have working config for gitea-buildin ssh server?

**Comment by anatanna** [comment]
This is working config. Closing the issue.
